{
  "schemaVersion": "zoia.generated-patch-graph.v1",
  "patchId": "draft-from-selection-121547-1",
  "name": "Draft 121547",
  "description": "Pre-export graph draft from verified template 121547: Midi controlled Envelope Filter, with LPF, BPF or HPF and optional OD and Reverb..",
  "expectedModalities": [
    "audio",
    "control",
    "effect",
    "cv"
  ],
  "modules": [
    {
      "id": "audio-in-1",
      "type": "Audio Input",
      "domain": "audio",
      "page": 0,
      "grid": 0,
      "params": {},
      "inputs": [],
      "outputs": [
        "audio"
      ]
    },
    {
      "id": "reverb-1",
      "type": "Reverb Lite",
      "domain": "audio",
      "page": 0,
      "grid": 1,
      "params": {
        "decay": 0.54,
        "tone": 0.5,
        "mix": 0.42
      },
      "inputs": [
        "audio",
        "mix_cv",
        "decay_cv"
      ],
      "outputs": [
        "audio"
      ]
    },
    {
      "id": "audio-out-1",
      "type": "Audio Output",
      "domain": "audio",
      "page": 0,
      "grid": 7,
      "params": {},
      "inputs": [
        "audio"
      ],
      "outputs": []
    },
    {
      "id": "control-source-1",
      "type": "Expression Pedal",
      "domain": "control",
      "page": 0,
      "grid": 2,
      "params": {},
      "inputs": [],
      "outputs": [
        "cv"
      ]
    }
  ],
  "connections": [
    {
      "id": "conn-audio-in-template",
      "from": {
        "moduleId": "audio-in-1",
        "port": "audio"
      },
      "to": {
        "moduleId": "reverb-1",
        "port": "audio"
      },
      "gain": 1
    },
    {
      "id": "conn-template-out",
      "from": {
        "moduleId": "reverb-1",
        "port": "audio"
      },
      "to": {
        "moduleId": "audio-out-1",
        "port": "audio"
      },
      "gain": 1
    },
    {
      "id": "conn-control-template",
      "from": {
        "moduleId": "control-source-1",
        "port": "cv"
      },
      "to": {
        "moduleId": "reverb-1",
        "port": "mix_cv"
      },
      "gain": 0.45
    }
  ]
}
