{
  "schemaVersion": "zoia.generated-patch-graph.v1",
  "patchId": "draft-from-selection-154821-1",
  "name": "Draft 154821",
  "description": "Pre-export graph draft from verified template 154821: Lux.",
  "expectedModalities": [
    "audio",
    "sample",
    "sequencer",
    "synth",
    "cv"
  ],
  "modules": [
    {
      "id": "audio-in-1",
      "type": "Audio Input",
      "domain": "audio",
      "page": 0,
      "grid": 0,
      "params": {},
      "inputs": [],
      "outputs": [
        "audio"
      ]
    },
    {
      "id": "synth-voice-1",
      "type": "Synth Voice",
      "domain": "audio",
      "page": 0,
      "grid": 1,
      "params": {
        "waveform": 0.42,
        "envelope": 0.58,
        "mix": 0.7
      },
      "inputs": [
        "audio",
        "pitch_cv",
        "gate_cv"
      ],
      "outputs": [
        "audio"
      ]
    },
    {
      "id": "audio-out-1",
      "type": "Audio Output",
      "domain": "audio",
      "page": 0,
      "grid": 7,
      "params": {},
      "inputs": [
        "audio"
      ],
      "outputs": []
    },
    {
      "id": "sequencer-1",
      "type": "CV Sequencer",
      "domain": "cv",
      "page": 0,
      "grid": 2,
      "params": {
        "steps": 0.8,
        "movement": 0.68
      },
      "inputs": [],
      "outputs": [
        "cv"
      ]
    }
  ],
  "connections": [
    {
      "id": "conn-audio-in-template",
      "from": {
        "moduleId": "audio-in-1",
        "port": "audio"
      },
      "to": {
        "moduleId": "synth-voice-1",
        "port": "audio"
      },
      "gain": 1
    },
    {
      "id": "conn-template-out",
      "from": {
        "moduleId": "synth-voice-1",
        "port": "audio"
      },
      "to": {
        "moduleId": "audio-out-1",
        "port": "audio"
      },
      "gain": 1
    },
    {
      "id": "conn-sequencer-template",
      "from": {
        "moduleId": "sequencer-1",
        "port": "cv"
      },
      "to": {
        "moduleId": "synth-voice-1",
        "port": "pitch_cv"
      },
      "gain": 0.62
    }
  ]
}
